id_empresa|nombre|logo|direccion|horario|descripcion|sitio_web|latitud|longitud|fecha_creacion
2e5cff6cb008f009eba3f50e9e949f0483586563|ASAKUSA SUSHIBAR RESTAURANTE|http://cde.2.ofertop.pe/est/440.jpg?201503301739|Av. Javier Prado Este 2994, San Borja|Horario de almuerzo: de lunes a jueves de 12:30 m. a 3:30 p.m.^^Horario de cena: de lunes a jueves de 7 p.m. a 11 p.m.|Asakusa Sushibar Restaurante fue creado por cuatro jóvenes peruanos japoneses, con la idea de ofrecer la mejor comida japonesa fusión de Lima. Cuenta con una variada y deliciosa carta, y un espectacular y bien surtido sushibar, además de un local con un bello local de estilo japonés contemporáneo y una atención de primera.|http://www.asakusa.pe/|-12.086826|-76.99668099999997|05-04-2015 14:00:00
0836bab8018e3d83f59bec83ef344ceb330befdb|MANDARÍN RESTAURANT-BUFFET|http://cde.2.ofertop.pe/est/1294.jpg?201503301739|Av. Javier Prado Este 1860 (cruce de Guardia Civil con Javier Prado), San Borja|De lunes a sábado de 12:30 m. a 4 p.m.|Mandarín Restaurant-Buffet tiene como misión satisfacer tu paladar, al momento de experimentar con nuevos sabores. Esto basado en la excelencia y calidad de sus productos y servicio. ¡Opta por una aventura gastronímica distinta!|http://www.buffetmandarin.com|-12.088933306755369|-77.00677001026463|05-04-2015 14:00:00
9ac42077ba8a693ed0796235fd22697bdf2e24ba|SANGUCHERÍA EL CHINITO||Av. Grimaldo del Solar 113 (alt. 7 de Benavides), Miraflores|De lunes a jueves de 8 a.m. a 3 p.m. y de 6 p.m. a 10 p.m. / viernes de 8 a.m. a 10 p.m.|Desde 1960 ''El Chinito'' es conocido como la mejor y más típica Sanguchería que ofrece los más deliciosos y tradicionales sánguches peruanos. El pan con chicharrón, con lechón o con pavita, son solo algunas de las más deliciosas especialidades que podrás disfrutar junto a familia o amigos en un grato y tradicional ambiente.|http://www.elchinito.com.pe|-12.122257988826057|-77.02579800244678|05-04-2015 14:00:00
85f6b598715eab12063635c44fc5d47f424a1b84|CHARLOTTE||Av. Rivera Navarrete 788, San Isidro|Horario de atención: de lunes a viernes de 8 a.m. a 9 p.m  / sábados de 8 a.m. a 1 p.m.|Charlotte es una cadena de cafeterías gourmet donde diariamente podrás disfrutar de una deliciosa lasagna de lomo saltado (premio al Mejor Plato Mistura 2010), unos maravillosos hotcakes, de un contundente club sándwich, ensaladas con aderezos insuperables y los más variados postres de Lima. ¡Visítalos, ya!|http://https://es-la.facebook.com/CharlottePeru|-12.0951446|-77.02649539999999|05-04-2015 14:00:00
9c002b27a09c942b64cd466828e429f710e2d72a|CUARTO & MITAD BEEF BAR||Av. Comandante Espinar 798, Miraflores|Horario de reservas: de lunes a viernes de 12:30 m. a 6 p.m.|Cuarto & Mitad Beef Bar tiene como especialidad a las carnes a la parrilla de la más selecta calidad, importada y nacional. Cuentan con platos de comida novoandina, pastas, pescados y mariscos; y una acogedora zona de bar donde podrás disfrutar de variados tragos. Su calidad en el servicio con atención personalizada cierra con broche de oro una experiencia gastronómica inolvidable.|http://restaurantcuartoymitad.com/|-12.1112845|-77.036989|05-04-2015 14:00:00
9baa6dcf8d62e9e31064aaf0ffd9b9ac5f1235b3|BARRANCO BEER COMPANY||Av. Almirante Grau 308, Barranco|De lunes a domingo de 5 p.m a 8 p.m.|Barranco Beer Company nacida de ideales cerveceros y costumbres peruanas, es una cervecería de concepto vanguardista, no obstante conserva las técnicas originales para la elaboración tradicional de la cerveza. Su especialidad son las cervezas tipo Craft-Artesanal, usando en su elaboración insumos de la más alta calidad, contando con el asesoramiento profesional continuo de cerveceros y microbiólogos para un buen control de calidad.|http://www.facebook.com/BarrancoBeerCompany|-12.1472730364287|-77.02219857344971|05-04-2015 14:00:00
479f0d4b70bb19be63f1451f5eca669c631d0e71|PURO PERÚ||Av. República de Panamá 258, Barranco|Horario de atención: sábado de 12 m. a 5 p.m.|Puro Perú es un prestigioso restaurante con una variedad de platos peruanos, donde disfrutarás de una nueva propuesta con originales variedades culinarias de nuestras regiones. Encontrarás en su buffet los más exquisitos pescados y mariscos, comida criolla, platos calientes, ensaladas, salteados y chaufas, pastas, sushi & rolls, flambeados, y exquisitos postres.|http://www.puroperu.com.pe/|-12.140015933102077|-77.01745524655763|05-04-2015 14:00:00
170aa79d5dd3cc55688e98a57309b8a193f19d35|LA ANTICUCHERÍA DE TRADICIÓN MORENA||Av. Caminos del Inca  1583, Urb. Las Gardenias (altura de la cuadra 53 de la Av. Benavides), Surco|De lunes a jueves de 1 p.m. a 4 p.m. y de 6 p.m. a 10 p.m. / de viernes a domingo de 1 p.m. a 10 p.m.|La Anticuchería de Tradición Morena es el restaurante temático especializado en parrilla peruana. Sus diversos platos como: Anticuchos, Pancita, Choncholí, Rachi, Mollejitas, etc, lo han colocado entre los mejores de la ciudad. Su alto nivel de servicio te dejará satisfecho, tanto como su sabor inigualable. ¡No te lo puedes perder!|http://www.laanticucheria.com|-12.12575418849355|-76.98243965398467|05-04-2015 14:00:00
5a59adcc09c83c0dcb6d30fa74ead76bb5549f10|LA DAMA JUANA|http://cde.2.ofertop.pe/est/1162.jpg?201503301739|Av. República de Panamá 230, Barranco|De lunes a domingo de 12:30 m. a 4 p.m. (almuerzo) / de lunes a domingo de 7:30 p.m. a 10 p.m. (cena)|La Dama Juana es un reconocido restaurante ubicado en el distrito de Barranco. Como buen representante de nuestra gastronomía ofrece a sus comensales una variada carta, así como los más selectos tragos y bebidas. Cuenta con elegantes y acogedores ambientes donde podrás disfrutar los mejores potajes de nuestra comida, viviendo una experiencia inolvidable.|http://ladamajuana.com.pe/|-12.14013131100782|-77.01785221349184|05-04-2015 14:00:00
329f57fff69d289a4f55e97f6231119ab841b770|EDO SUSHI BAR.|http://cde.2.ofertop.pe/est/1163.jpg?201503301739|C.C. Jockey Plaza (Av. Javier Prado Este 4200, Surco)|De lunes a jueves de 12 m. a 10 p.m.|Disfruta la aventura culinaria de la comida nikkei en EDO Sushi Bar. La fusión de la cocina japonesa y peruana en una versión moderna y fresca, donde los Itamaes expertos aportarán sus conocimientos para deslumbrar a tu paladar.|http://www.edosushibar.com|-12.084798|-76.97837679999998|05-04-2015 14:00:00
6317ba5dcc846a6464cc6e1d675043fc9d7db047|LA CANDELARIA|http://cde.2.ofertop.pe/est/408.jpg?201503301739|Av. Bolognesi 292, Barranco|Horario del espectáculo: de 10:30 p.m. a 2:30 a.m.|La Candelaria basa su indudable éxito en su singular propuesta dancística que lleva un mensaje rotundo de peruanidad. Sus tres pilares fundamentales para mantener la calidad de sus espectáculos son sin duda las extraordinarias particularidades de sus danzas excelentemente conducidas; su exquisita cocina, su creativo y surtido bar y la gran calidad de sus servicios.^Un hito importante de esta casa barranquina ha sido también, la introducción en sus celebraciones por Año Nuevo de un novedoso concepto artístico sobre el ancestral rito andino del “pago a la pachamama”, que se ha convertido en la mayor atracción de esta fecha. Además, encontrarás un servicio de primera, sonido inmejorable, pródiga iluminación con buena pista de baile y sobre todo un recuerdo inolvidable.|http://www.lacandelariaperu.com|-12.14886848053975|-77.01996508227836|05-04-2015 14:00:00
aeaf661b77cccb0caad3eb407eb74585771b9851|SWEET WAFFLES||C.C. Comercial Real Plaza Primavera piso 2, frente al Patio de comidas|De lunes a domingo de 11 a.m. a 10 p.m.|Disfruta de los riquísimos postres que Sweet Waffles ofrece para ti. Tiene a disposición de tu paladar los más ricos waffles belgas, milkshakes y frappés en variados sabores. ¡Disfrútalos en su versión original o agrégales todos los toppings que quieras!|http://www.facebook.com/sweetwafflesperu|-12.111015478760871|-77.00193873977662|05-04-2015 14:00:00
a9075c7fc5fa8496137a012348379f1fc12e4c8a|DON ROSALINO||LOCAL 1: Av. República de Panamá 5897, Miraflores / LOCAL 2: Av. Aviación 2667, San Borja|De lunes a jueves de 12 m. a 3 p.m. y de 7 p.m. a 10 p.m. (Miraflores) / de lunes a jueves de 12:30 m. a 10 p.m. (San Borja)|Desde 1977, Don Rosalino mantiene la esencia de sus recetas italianas ahora complementadas con ingredientes y variantes de la gastronomía nacional. Esto hace a Don Rosalino único en su categoría, brindando la mejor experiencia de servicio en cada atención, y utilizando insumos de alta calidad para garantizar un producto único que se mantenga en la memoria y paladar de sus comensales.|http://es-es.facebook.com/donrosalinorestaurante|-12.121741332718637|-77.01793543434144|05-04-2015 14:00:00
697c11968383b9ccb6e880c25b0ca76a9dcc488c|HIKARI POLLERÍA - RESTAURANTE DE LA MOLINA||Av. Flora Tristán 439 - Urb. Sta. Patricia - La Molina|Horario de atención: de lunes a viernes de 12 m. a 11 p.m.|Hikari es una palabra de origen japonés que significa luz, destello. Hace 35 años, estas connotaciones sirvieron de inspiración a una joven pareja para abrir el primer local de la cadena de restaurantes que hoy lleva ese nombre. El amor entre ellos y su pasión por hacer las cosas bien, hicieron que esta polleria, ubicada en el Rímac, tuviera pronto éxito. Hoy, Hikari cuenta con 6 locales, todos con el firme compromiso de seguir siendo tu lugar favorito para compartir momentos de placer. ¡Visítalos!|http://www.hikari.pe|-12.071040353675508|-76.94185425737766|05-04-2015 14:00:00
005fe49ef27c93f33720f301aaffc5d67c7b939a|RESTAURANTE ESPAÑOL EL QUIJOTE||Calle Berlín 609,  Miraflores|Horario de atención: de lunes a viernes de 6 p.m. a 11 p.m.|Restaurante español El Quijote te abre las puertas al mundo gastronómico que España guarda para ti. Degusta sus más exquisitas recetas, mientras te sientes como en casa gracias a su gran servicio al cliente. ¡Qué esperas, come rico y bueno!|http://www.restaurantelquijote.com|-12.1202688|-77.03618560000001|05-04-2015 14:00:00
6ec8a46ba188ec43b90a7de0e5ccd3f5691d82a8|CEBICHERÍA MARÍA PASTOR||Av. Cuba 1200, Jesús María|Horario de atención: de lunes a viernes de 12:30 m. a 3 p.m.|La Cebichería María Pastor está ubicada en el corazón de Jesús María y es el punto ideal para disfrutar de lo mejor en pescados, mariscos y comida criolla. Sus especialidades son el cebiche, la leche de tigre, el seco de cabrito y el arroz con pato, entre otros. La atención es de primera y las mesas siempre están listas para recibir a sus fieles comensales.|http://www.cebicheriamaria.com|-12.0750252|-77.0467066|05-04-2015 14:00:00
f488bda484aec50e772796544b0ad44af7ce9abe|ANANDA LOUNGE||Pasaje Julio C. Tello 269, Miraflores|Horario de atención: de martes a viernes de 6 p.m. a 11 p.m.|En Ananda Lounge ven y disfruta de la mejor experiencia, degustando los más deliciosos tragos, exquisitos piqueos y makis. Cuentan con una distribución de boxes privados súper cómodos, meseros que te brindarán una atención personalizada, los mejores bartenders y la mejor música en vivo.|http://www.anandalounge.com/ananda/|-12.12160496759892|-77.02842287158967|05-04-2015 14:00:00
033939d81d9daad11ba695908e063d099231e988|EL PAPAPA||Av. Villarán 824, Surquillo (A 4 cuadras de la Av. Aviación)|Horario de atención: de lunes a jueves de 4 p.m. a 12 a.m. / viernes y sábados de 4 p.m. a 1 a.m. / domingos de 4 p.m. a 12 a.m.|En El Papapa tienen la consigna de hacerte sentir “como en casa” con la estrella de su carta a la cabeza: sus salchipapas ofrecidas en distintas versiones elaboradas con frescos ingredientes y una gran variedad de salsas. Por ejemplo, La Tía de Huacho, La Prima; y El Papapa. Además, todos sus platos vienen acompañados de gaseosa ilimitada.^Y para los que prefieren cuidar la línea, también hay platos ligeros pero sabrosos como La Vecina y La Hermana. ¡Te invitamos a probar su deliciosa sazón!|http://www.facebook.com/elpapapa01/timeline|-12.12092838578219|-77.00302235221864|05-04-2015 14:00:00
a41021863714231e90f4f2606a4f3fa0caa4b33f|HIKARI POLLERÍA - RESTAURANTE DE SAN MIGUEL||Av. La Mar 2339, San Miguel|Horario de atención: de lunes a viernes de 12 m. a 11 p.m.|Hikari es una palabra de origen japonés que significa luz, destello. Hace 35 años, estas connotaciones sirvieron de inspiración a una joven pareja para abrir el primer local de la cadena de restaurantes que hoy lleva ese nombre. El amor entre ellos y su pasión por hacer las cosas bien, hicieron que esta polleria, ubicada en el Rímac, tuviera pronto éxito. Hoy, Hikari cuenta con 6 locales, todos con el firme compromiso de seguir siendo tu lugar favorito para compartir momentos de placer. ¡Visítalos!|http://www.hikari.pe|-12.074854991462232|-77.08322528308105|05-04-2015 14:00:00
c8b76da43936a2eec3d876a64a14eab551850df4|PLANET CHICKEN||Av. Alfredo Mendiola 3698 - C.C. Megaplaza Norte|Horario de atención: de lunes a jueves de 12 m. a 11 p.m.|Planet Chicken es la primera cadena peruana de restaurantes en ofrecerte el mejor Pollo a la brasa, acompañado de nuestra deliciosa comida criolla. Con un ambiente único que rinde tributo a la peruanidad, sus entretenidos restaurantes han sido diseñados para presentarte los mejores shows en vivo y para que puedas cantar con tus amigos en su espectacular Karaoke.|http://es-la.facebook.com/planetchicken|-11.99395228992712|-77.06148148435591|05-04-2015 14:00:00
325bd4a54df6a4c4676ae2f2fe474419bbfdbe1d|BIG LILA CAFÉ|http://cde.2.ofertop.pe/est/1364.jpg?201503301739|Av. Rivera Navarrete 841, San Isidro|De lunes a viernes de 7 a.m. a 10 p.m. / sábado de 8 a.m. a 4 p.m.|Big Lila Café, es un lugar cómodo y reconfortante donde podrás disfrutar toda la carta que te ofrece con ideas novedosas y deliciosas. En Big Lila Café serás recibido con las puertas abiertas y serás atendido por un personal con experiencia en el rubro de cafetería.|http://es-la.facebook.com/BigLila|-12.095715331906174|-77.02651157665173|05-04-2015 14:00:00
78d85718625a999e84429af4d1d14f9d64c9fd33|PASO OBLIGAO|http://cde.2.ofertop.pe/est/413.jpg?201503301739|Av. Manuel Valle, Mz. G Lt. 10 (A 2 Km. del ingreso a Pachacámac), Pachacámac.|Horario de atención: sábados de 9 a.m. a 12 p.m.|Paso Obligao tiene casi 20 años en el mercado, siendo los pioneros en servir pollos a la leña en Lima. Hasta hoy tienen 4 locales, el último se encuentra en Pachacamac, que a diferencia de los otros, aquí se cocina todo en hornos de barro a la leña. Son ganadores de tres premios en el concurso anual de cocina Ecogurmet de Pachacamac. Su comida se caracteriza por ser lo más natural posible, usando productos del valle, combinados con insumos de la sierra, como las papas nativas, ocas y mashuas. La atención es de gran calidad y personalizada, y van de la mano de sus colaboradores, quienes atienden gustosamente a cada uno de sus comensales, haciéndolos sentir como en su propia casa.|http://pasoobligao.com/bienvenida.php|-12.22569859296973|-76.86139241914066|05-04-2015 14:00:00
6ec8a46ba188ec43b90a7de0e5ccd3f5691d82a8|CEBICHERÍA MARÍA PASTOR||Av. Cuba 1200, Jesús María|Horario de atención: de lunes a domingo de 7 p.m. a 10 p.m.|La Cebichería María Pastor está ubicada en el corazón de Jesús María y es el punto ideal para disfrutar de lo mejor en pescados, mariscos y comida criolla. Sus especialidades son el cebiche, la leche de tigre, el seco de cabrito y el arroz con pato, entre otros. La atención es de primera y las mesas siempre están listas para recibir a sus fieles comensales.|http://www.cebicheriamaria.com|-12.0750252|-77.0467066|05-04-2015 14:00:00
ab4ce9deae33e87f73b49c6ab4cd7b8c100bce08|CIPRIANA RESTAURANTE||Calle Chamaya 153, Urb. Ponce, San Miguel|Horario de atención: de lunes a viernes de 12 m. a 10 p.m.|Restaurante Cipriana es el único establecimiento en la zona especializado en comida peruana contemporánea preparada a base de carne fresca y sazonada con insumos de primera calidad. En Restaurante Cipriana, toman recetas de antaño y las transforman en presentaciones modernas que te harán sentir como si estuvieras en casa. Cuentan con una amplia variedad de platos, para todos los gustos, ya sea niños, jóvenes y adultos, lo que los cataloga como un espacio 100% familiar.|http://www.cipriana.pe/|-12.075245641124841|-77.08215707116392|05-04-2015 14:00:00
78a5755f881d9f8d07f7f7b4619b4074f1677dea|LONGHORN ||MegaPlaza Lima Norte, Independencia|De lunes a viernes de 4 p.m. a 10 p.m.|En Long Horn podrás degustar los más exquisitos cortes de carne Premium americana y argentina, todo ello acompañado de una exquisita pasta y la mejor selección de vinos y licores, en un cálido ambiente y con la buena atención que los caracteriza. ¡Ve y vive la experiencia Long Horn!|http://www.longhorn.com.pe/view/|-11.99396278454756|-77.0614627088928|05-04-2015 14:00:00
155d910332fc5fc781e49cbe2f760bf5cc652c9d|D'' TINTO & BIFE||Costa Verde S/N, Barranco (Playa Las Cascadas mod 4)|De martes a viernes de 12:30 m. a 11 p.m.|D''Tinto & Bife Resto Bar se ubica a pocos metros del mar en el circuito de playas de la Costa Verde en el distrito de Barranco. Aquí no solo encontrarás sus clásicas parrillas con exquisitas carnes como bifes, picañas, lomos y cuadriles, sino también podrás disfrutar de una mayor variedad en comida internacional y marina.|http://www.detintoybife.com/|-12.1387198|-77.02830449999999|05-04-2015 14:00:00
c7365223b95eac5aaf0ba6f807483ed39d8e3353|POLO MARINO ||Av. El Polo 605, Surco|De lunes a sábado: 12 m. a 4 p.m. y de 7:30 p.m. a 10 p.m.|Polo Marino posee el ambiente perfecto para disfrutar de la mejor comida marina y cocina fusión. Encontrarás una variada carta, acogedoras instalaciones y un staff de profesionales dispuestos ofrecerte un servicio de primera.|http://www.polomarino.com/|-12.10222790286898|-76.97226226627043|05-04-2015 14:00:00
d582beb2b9ddd56933faaa66ee732ae0439e7237|LA CHOZA NÁUTICA DE LINCE||Jr. Brigadier Pumacahua 2374 (altura de la cdra. 9 de Av. Canevaro), Lince|De lunes a jueves de 1:30 p.m. a 4:30 p.m.|La Choza Náutica ofrece a sus comensales una gran variedad de  delicias para su paladar, con mas de 180 variedades de platos con especialidad en pescados, mariscos y parrillas de todas las carnes, acompañados de exóticos tragos; garantizándote calidad y frescura en los productos de su carta.|http://www.chozanautica.com/|-1|-1|05-04-2015 14:00:00
e37d97ed42430e82762c2cade0089410b2ff5d60|ANANKE TRATTORÍA PERUANA||Jr. Cusco 709, Magdalena|De martes a domingo de 12:30 m. a 3 p.m.|Ananké es una Trattoría de comida Italiana y criolla, donde su especialidad es el buffet. ¡Visítalos y arrasa con toda su cocina!|http://www.facebook.com/ananketrattoriaperuana?fref=ts|-12.088090584450564|-77.07337858335882|05-04-2015 14:00:00
69c51a33df88d26e642b12e7db70672adc740377|AMARISCOS, PESCADOS Y MARISCOS||Av. Javier Prado Este 6529, La Molina|Horario de atención: de martes a domingo de 12 m. a 4 p.m.|Amariscos, Pescados y Mriscos con más de 13 años en el mercado, se han convertido en especialistas de la cocina de pescados y mariscos. Cada uno de sus platos ha sido elaborado con insumos de primera calidad y los más frescos ingredientes. Su staff de profesionales te permitirá vivir una experiencia gastronómica inolvidable.|http://amariscos.com/|-12.0796538|-76.96619199999998|05-04-2015 14:00:00
2094e9ae965b8d803108f80b53446b13456f1016|RESTAURANTE D´PASO||Alameda Mamacona Lote 1 (Alt. Km 28 Antigua Panamericana Sur- Terminado el Parque del Recuerdo), Pachacámac|De martes a viernes desde las 11 a.m. / Inicio del show: 12:30 p.m.|Restaurante D´Paso ubicado en Mamacona ofrece una propuesta distinta a los comensales, pues los recibe con deliciosos platos típicos y con una puesta en escena que representa parte de la historia de nuestro país. Su exhibición "Luces y Sonidos del Caballo del Perú", danzas y música de la costa, sierra y selva, se convierten en todo un espectáculo.|http://www.facebook.com/CaballoPeruanodePaso|37.2079057|-4.657305500000007|05-04-2015 14:00:00
c8b76da43936a2eec3d876a64a14eab551850df4|PLANET CHICKEN||Av. Alfredo Mendiola 3698 - C.C. Megaplaza Norte|Horario de atención: de lunes a sábado de 12 m. a 12 p.m. /  domingo de 12 m. a 11 p.m.^^Podrás validar tu oferta solo de lunes a jueves de 12 p.m. a 11 p.m.|Planet Chicken es la primera cadena peruana de restaurantes en ofrecerte el mejor Pollo a la brasa, acompañado de nuestra deliciosa comida criolla. Con un ambiente único que rinde tributo a la peruanidad, sus entretenidos restaurantes han sido diseñados para presentarte los mejores shows en vivo y para que puedas cantar con tus amigos en su espectacular Karaoke.|http://es-la.facebook.com/planetchicken|-11.99395228992712|-77.06148148435591|05-04-2015 14:00:00
8a02ebefecc21ff8bc23e35d2755271828cf9348|EL RANCHO GRANDE||Mz. C, Lt. 39, Asociación Huertos de Tungasuca, Comas|De lunes a viernes de 12 m. a 5 p.m.|El Rancho Grande deleita a sus clientes desde hace 30 años brindándole una sazón especial a todos sus platillos para complacer a los amantes de la comida criolla. Pone por ejemplo, a gusto del cliente, sus espectaculares cuy chactado acompañado de papas coloradas, cecinas ahumadas de carne de caza servida con mote cusqueño, tallarines, caldos, pichones de castilla; y mucho más.|http://www.elranchograndedelperu.com/|-11.90975265763975|-77.0558671799011|05-04-2015 14:00:00
a9075c7fc5fa8496137a012348379f1fc12e4c8a|DON ROSALINO||Miraflores: Av. República de Panamá 5897 / San Borja: Av. Aviación 2667|De lunes a jueves de 12 m. a 3 p.m. y de 7 p.m. a 10 p.m. (Miraflores) / de lunes a jueves de 12:30 m. a 10 p.m. (San Borja)|Desde 1977, Don Rosalino mantiene la esencia de sus recetas italianas ahora complementadas con ingredientes y variantes de la gastronomía nacional. Esto hace a Don Rosalino único en su categoría, brindando la mejor experiencia de servicio en cada atención, y utilizando insumos de alta calidad para garantizar un producto único que se mantenga en la memoria y paladar de sus comensales.|http://www.donrosalino.com/|-12.121741332718637|-77.01793543434144|05-04-2015 14:00:00
9b2c3bbb486aff3756e9c92947d1f8d7e813c3ec|LONG HORN - MEGAPLAZA||Av. Alfredo Mendiola 3698 - C.C. Megaplaza, Independencia|De lunes a viernes de 4 p.m. a 9 p.m.|En Long Horn podrás degustar los más exquisitos cortes de carne Premium americana y argentina, todo ello acompañado de una exquisita pasta y la mejor selección de vinos y licores, en un cálido ambiente y con la buena atención que los caracteriza. ¡Ve y vive la experiencia Long Horn!|http://www.longhorn.com.pe/view/|-11.99396278454756|-77.0614627088928|05-04-2015 14:00:00
51150650966b94b93299891ac4d2a2aeed25d6c7|80''S RESTO BAR||Av. Larco 101, Sótano del Centro Comercial Caracol, Miraflores|De lunes a sábados de 1 p.m. a 5 p.m.|80''s Resto Bar es un restaurante temático, que  ofrece la mejor carta de comida Peruana-Fusión, piqueos innovadores, selecta carta de bar con tragos que llevan nombres de las canciones más representativas de los ochenta. Está ambientado con la mejor música de esa década y los mejores videos. Así también los fines de semana ofrecen espectáculos de bandas en vivo y artistas reconocidos. Tiene 2 salones privados, salón de eventos, comedor principal, 2 barras y pista de baile.|http://www.ochentasrestobar.com/|-12.1292266|-77.02976519999999|05-04-2015 14:00:00
b151e24a815827ae5eec8f51a21e7cba76f7f99f|ENCUENTRO MARINO||Av. Antigua Panamericana Sur Km. 41 (Ingreso a la Playa los Pulpos) - Lurín|De lunes a domingo de 11 a.m. a 6 p.m.|Encuentro Marino especializa su sazón inspirado en los más ricos frutos de nuestro mar. ¡Visítalos en Lurín y disfruta de un intenso sabor! ;)|http://www.facebook.com/cebicheriaencuentromarino|-12.30626828540785|-76.84066287612916|05-04-2015 14:00:00
f5b3f8ed394eaf010c5870bd54d5ff6d1021bf99|EN SU PUNTO||Calle Doña Delmira 400, Urb. Los Rosales,  Santiago de Surco|De lunes a domingo de 11:30 a.m. a 4 p.m.|Restaurante En Su Punto se especializa en comida criolla como: arroz con pato, seco de cabrito, asado de costillar con frejoles, cau cau, mondonguito y más. Su compromiso no solo está en preparar la mejor comida, sino también brindar una esmerada atención a cada uno de sus comensales.||-12.143728|-77.00214619999997|05-04-2015 14:00:00
625da7db09b7bfc2411c96cf54d97ebc29f9705d|SUSHI BAR DEL PILAR||Pasaje Mártir Olaya 141, Miraflores|Horario de atención: de lunes a sábado de 1 p.m. a 4 p.m. (almuerzo) y de 6 p.m. a 11 p.m. (cena)|Sushi Bar Del Pilar es un área del Hotel Del Pilar Miraflores, el cual abrió sus puertas en 1998, heredando su prestigio y calidad en el servicio. Su misión es consolidarse como una nueva y fresca opción gastronómica respecto a la comida japonesa.|http://www.delpilarmirafloreshotel.com/lan/esp/indexa.php|-12.119423563274955|-77.03010237103092|05-04-2015 14:00:00
7425e3f3a951c8eed0a2a78e695b104e2d454eb4|LA PASTANA ||DELIVERY|Horario del delivery:  viernes de 5 p.m. a 11:00 p.m / sábados de 11 a.m a 11 p.m / domingos de 11 a.m a 9 p.m.|Con la recomendación del mismísimo chef Gastón Acurio, los fundadores de La Pastana supieron que se ganarían el corazón del público limeño conquistando las tierras de su estómago. Aliados con las pastas y los sentimientos que condimentan un buen plato, se dedican todos los días a crear preparaciones repletas de sabor y emociones, que dejan en las puertas de todos aquellos que deseen evocar la comida casera.|http://www.facebook.com/lapastana|-1|-1|05-04-2015 14:00:00
